{
  "response_id": "example-recgen-res-2026-04-08-001",
  "request_id": "example-recgen-req-2026-04-08-001",
  "project_id": "clixsy-oracle-agent",
  "created_at": "2026-04-08T20:06:00Z",
  "subject": "Synthetic response for recommendation generation contract demonstration",
  "generated_recommendations": [
    {
      "draft_id": "example-rec-draft-2026-04-08-001",
      "subject": "Synthetic recommendation draft for response wrapper demonstration",
      "title": "Continue contract-first progression before runtime coupling",
      "summary": "Use evidence-linked contract artifacts as the immediate recommendation output path until committed runtime producers and consumers exist.",
      "recommendation_type": "implement",
      "supporting_evidence_bundle_ids": [
        "example-bundle-2026-04-08-001"
      ],
      "rationale": "The provided evidence bundle indicates a sparse, documentation-forward phase where stable contract boundaries reduce premature implementation coupling.",
      "confidence": {
        "level": "medium",
        "rationale": "Grounded in known synthetic evidence, with residual uncertainty from missing runtime implementation details."
      },
      "priority": {
        "level": "high",
        "urgency": "soon",
        "rationale": "Recommendation quality and traceability improve when contract boundaries are established early."
      },
      "assumptions": [
        "Future recommendation persistence can map draft recommendations into full recommendation artifacts."
      ],
      "unknowns": [
        "Which committed component will first generate recommendation records in operational flow."
      ],
      "suggested_next_steps": [
        "Validate generated recommendation objects against recommendation_generation_response.schema.json.",
        "Keep draft evidence linkage explicit through supporting_evidence_bundle_ids."
      ],
      "notes": "Synthetic recommendation output included for contract illustration only."
    }
  ],
  "unresolved_unknowns": [
    "Evidence is limited to currently available synthetic bundle context.",
    "No committed runtime generation pipeline exists yet."
  ],
  "warnings": [
    "This response demonstrates shape and traceability boundaries only.",
    "Do not treat this synthetic output as real client or production recommendation data."
  ],
  "notes": "Synthetic example only. Not client data and not MarketBrew production output."
}
